{
  "name": "plain",
  "description": "Nothing but the text, set well: what a README looks like on paper.",
  "typeface": "sans",
  "page": { "margin": 56, "runningInset": 24 },
  "scale": { "body": 10.5, "leading": 1.45, "paragraphGap": 0.75, "blockGap": 0.9 },
  "title": { "style": "none", "size": 22, "weight": "bold", "byline": false, "rule": false, "logo": false, "gap": 1.0 },
  "headings": [
    { "size": 20, "weight": "bold", "colour": "ink", "rule": true, "before": 1.6, "after": 0.6 },
    { "size": 15, "weight": "bold", "colour": "ink", "rule": true, "before": 1.5, "after": 0.5 },
    { "size": 12, "weight": "bold", "colour": "ink", "before": 1.3, "after": 0.4 },
    { "size": 10.5, "weight": "bold", "colour": "ink", "before": 1.1, "after": 0.3 }
  ],
  "code": { "fill": "wash", "border": false, "size": 8.8, "label": false },
  "quote": { "bar": "hairline", "italic": false, "colour": "muted", "inset": 14 },
  "table": { "headerFill": "none", "striped": true, "rules": true, "size": 9.5 },
  "lists": { "bullet": "•", "colour": "ink", "indent": 16 },
  "links": { "colour": "accent", "underline": false },
  "header": { "left": "none", "centre": "none", "right": "none", "rule": false, "firstPage": false },
  "footer": { "left": "none", "centre": "none", "right": "number", "rule": false, "firstPage": true }
}
